{
  "Id": "8a9972b9-fe88-48a5-889a-32ab03062d6a",
  "DiscoveredAt": "2026-10-01T20:20:32.3716217+00:00",
  "HoldingCompany": "999",
  "WaveId": "1",
  "Environment": "system",
  "Documents": [
    {
      "DocumentId": 10382249,
      "DocumentCuid": "AQCjgO9UUrpLsXNzkbWCukI",
      "Name": "Test10_QueryWithSubQuery_WithSpace",
      "FolderPath": "H999 - No Bank/H999_General/OracleToSnowflake_CHAR_VARCHAR/Fixed - No Space",
      "Owner": null,
      "DocumentType": "Webi",
      "IsPersonalFolderDocument": false,
      "ReadyToMigrate": true,
      "StatusMessage": null,
      "DataProviders": [
        {
          "Id": "DP0",
          "Name": "Test10_QueryWithSubQuery_WithSpace",
          "StatusMessage": null,
          "OracleDataSourceType": "Unx",
          "SnowflakeDataSourceType": "Unx",
          "OracleDataSourceId": 35230,
          "OracleDataSourceCuid": "AcljoUtBUs1Mmz1h8QIEmMQ",
          "OracleDataSourceName": "Total Customer View Daily Universe.unx",
          "SnowflakeDataSourceId": 8769479,
          "SnowflakeDataSourceCuid": "ATAa6szNqeZHnyRhX0mJqPc",
          "SnowflakeDataSourceName": "Total Customer View Daily Universe.unx"
        }
      ],
      "CharSpaceFindings": []
    },
    {
      "DocumentId": 10382250,
      "DocumentCuid": "AWpdjtw8i1hIp7rvfwzzN1o",
      "Name": "Test11_QueryCustom_WithSpace",
      "FolderPath": "H999 - No Bank/H999_General/OracleToSnowflake_CHAR_VARCHAR/Fixed - No Space",
      "Owner": null,
      "DocumentType": "Webi",
      "IsPersonalFolderDocument": false,
      "ReadyToMigrate": true,
      "StatusMessage": null,
      "DataProviders": [
        {
          "Id": "DP0",
          "Name": "Test11_QueryCustom_WithSpace",
          "StatusMessage": null,
          "OracleDataSourceType": "Unx",
          "SnowflakeDataSourceType": "Unx",
          "OracleDataSourceId": 35230,
          "OracleDataSourceCuid": "AcljoUtBUs1Mmz1h8QIEmMQ",
          "OracleDataSourceName": "Total Customer View Daily Universe.unx",
          "SnowflakeDataSourceId": 8769479,
          "SnowflakeDataSourceCuid": "ATAa6szNqeZHnyRhX0mJqPc",
          "SnowflakeDataSourceName": "Total Customer View Daily Universe.unx"
        }
      ],
      "CharSpaceFindings": []
    },
    {
      "DocumentId": 10382251,
      "DocumentCuid": "AfczYnKe4u9BlgZ2FvA.a1I",
      "Name": "Test12_QueryDeleteTrailingBlanksVariable_WithSpace",
      "FolderPath": "H999 - No Bank/H999_General/OracleToSnowflake_CHAR_VARCHAR/Fixed - No Space",
      "Owner": null,
      "DocumentType": "Webi",
      "IsPersonalFolderDocument": false,
      "ReadyToMigrate": true,
      "StatusMessage": null,
      "DataProviders": [
        {
          "Id": "DP0",
          "Name": "Test12_QueryDeleteTrailingBlanksVariable_WithSpace",
          "StatusMessage": null,
          "OracleDataSourceType": "Unx",
          "SnowflakeDataSourceType": "Unx",
          "OracleDataSourceId": 35230,
          "OracleDataSourceCuid": "AcljoUtBUs1Mmz1h8QIEmMQ",
          "OracleDataSourceName": "Total Customer View Daily Universe.unx",
          "SnowflakeDataSourceId": 8769479,
          "SnowflakeDataSourceCuid": "ATAa6szNqeZHnyRhX0mJqPc",
          "SnowflakeDataSourceName": "Total Customer View Daily Universe.unx"
        }
      ],
      "CharSpaceFindings": []
    },
    {
      "DocumentId": 10382240,
      "DocumentCuid": "Ad2cdtHimb1JrMekQWiLGtw",
      "Name": "Test1_Query_WithSpace",
      "FolderPath": "H999 - No Bank/H999_General/OracleToSnowflake_CHAR_VARCHAR/Fixed - No Space",
      "Owner": null,
      "DocumentType": "Webi",
      "IsPersonalFolderDocument": false,
      "ReadyToMigrate": true,
      "StatusMessage": null,
      "DataProviders": [
        {
          "Id": "DP0",
          "Name": "Test1_Query_WithSpace",
          "StatusMessage": null,
          "OracleDataSourceType": "Unx",
          "SnowflakeDataSourceType": "Unx",
          "OracleDataSourceId": 35230,
          "OracleDataSourceCuid": "AcljoUtBUs1Mmz1h8QIEmMQ",
          "OracleDataSourceName": "Total Customer View Daily Universe.unx",
          "SnowflakeDataSourceId": 8769479,
          "SnowflakeDataSourceCuid": "ATAa6szNqeZHnyRhX0mJqPc",
          "SnowflakeDataSourceName": "Total Customer View Daily Universe.unx"
        }
      ],
      "CharSpaceFindings": []
    },
    {
      "DocumentId": 10382241,
      "DocumentCuid": "AXIYahgt6gtAiNsvbITmZDo",
      "Name": "Test2_Variable_WithSpace",
      "FolderPath": "H999 - No Bank/H999_General/OracleToSnowflake_CHAR_VARCHAR/Fixed - No Space",
      "Owner": null,
      "DocumentType": "Webi",
      "IsPersonalFolderDocument": false,
      "ReadyToMigrate": true,
      "StatusMessage": null,
      "DataProviders": [
        {
          "Id": "DP0",
          "Name": "Test2_Variable_WithSpace",
          "StatusMessage": null,
          "OracleDataSourceType": "Unx",
          "SnowflakeDataSourceType": "Unx",
          "OracleDataSourceId": 35230,
          "OracleDataSourceCuid": "AcljoUtBUs1Mmz1h8QIEmMQ",
          "OracleDataSourceName": "Total Customer View Daily Universe.unx",
          "SnowflakeDataSourceId": 8769479,
          "SnowflakeDataSourceCuid": "ATAa6szNqeZHnyRhX0mJqPc",
          "SnowflakeDataSourceName": "Total Customer View Daily Universe.unx"
        }
      ],
      "CharSpaceFindings": []
    },
    {
      "DocumentId": 10382242,
      "DocumentCuid": "AR3AHMEtVVZBkvuq1_8PSSs",
      "Name": "Test3_ReportFilter_WithSpace",
      "FolderPath": "H999 - No Bank/H999_General/OracleToSnowflake_CHAR_VARCHAR/Fixed - No Space",
      "Owner": null,
      "DocumentType": "Webi",
      "IsPersonalFolderDocument": false,
      "ReadyToMigrate": true,
      "StatusMessage": null,
      "DataProviders": [
        {
          "Id": "DP0",
          "Name": "Test3_ReportFilter_WithSpace",
          "StatusMessage": null,
          "OracleDataSourceType": "Unx",
          "SnowflakeDataSourceType": "Unx",
          "OracleDataSourceId": 35230,
          "OracleDataSourceCuid": "AcljoUtBUs1Mmz1h8QIEmMQ",
          "OracleDataSourceName": "Total Customer View Daily Universe.unx",
          "SnowflakeDataSourceId": 8769479,
          "SnowflakeDataSourceCuid": "ATAa6szNqeZHnyRhX0mJqPc",
          "SnowflakeDataSourceName": "Total Customer View Daily Universe.unx"
        }
      ],
      "CharSpaceFindings": []
    },
    {
      "DocumentId": 10382243,
      "DocumentCuid": "AU1mf0eT8fFPrmKNDgbljI8",
      "Name": "Test4_Merge_WithSpace",
      "FolderPath": "H999 - No Bank/H999_General/OracleToSnowflake_CHAR_VARCHAR/Fixed - No Space",
      "Owner": null,
      "DocumentType": "Webi",
      "IsPersonalFolderDocument": false,
      "ReadyToMigrate": true,
      "StatusMessage": null,
      "DataProviders": [
        {
          "Id": "DP0",
          "Name": "Test4_Merge_WithSpace_TCV",
          "StatusMessage": null,
          "OracleDataSourceType": "Unx",
          "SnowflakeDataSourceType": "Unx",
          "OracleDataSourceId": 35230,
          "OracleDataSourceCuid": "AcljoUtBUs1Mmz1h8QIEmMQ",
          "OracleDataSourceName": "Total Customer View Daily Universe.unx",
          "SnowflakeDataSourceId": 8769479,
          "SnowflakeDataSourceCuid": "ATAa6szNqeZHnyRhX0mJqPc",
          "SnowflakeDataSourceName": "Total Customer View Daily Universe.unx"
        },
        {
          "Id": "DP4",
          "Name": "Test4_Merge_WithSpace_DP_ADS",
          "StatusMessage": null,
          "OracleDataSourceType": "Unx",
          "SnowflakeDataSourceType": "Unx",
          "OracleDataSourceId": 36007,
          "OracleDataSourceCuid": "AYVryeE8DdJCkWk4G5epyGs",
          "OracleDataSourceName": "ADS Deposit Production Universe.unx",
          "SnowflakeDataSourceId": 9753638,
          "SnowflakeDataSourceCuid": "AfqO2Iaplr5IsRUn7adDyZQ",
          "SnowflakeDataSourceName": "ADS Deposit Production Universe.unx"
        },
        {
          "Id": "DP5",
          "Name": "Test4_Merge_WithSpace_DP_DDW",
          "StatusMessage": null,
          "OracleDataSourceType": "Unx",
          "SnowflakeDataSourceType": "Unx",
          "OracleDataSourceId": 34887,
          "OracleDataSourceCuid": "AUidNnXFmy9Ouu2PNrFI27s",
          "OracleDataSourceName": "Deposit Daily - Production.unx",
          "SnowflakeDataSourceId": 8769439,
          "SnowflakeDataSourceCuid": "AReh9Rl.j41ClDWl9IXLO68",
          "SnowflakeDataSourceName": "Deposit Daily - Production.unx"
        }
      ],
      "CharSpaceFindings": []
    },
    {
      "DocumentId": 10382244,
      "DocumentCuid": "AaIpWhfAdsROn0hehNs4A1s",
      "Name": "Test5_QueryUsingQuery_WithSpace",
      "FolderPath": "H999 - No Bank/H999_General/OracleToSnowflake_CHAR_VARCHAR/Fixed - No Space",
      "Owner": null,
      "DocumentType": "Webi",
      "IsPersonalFolderDocument": false,
      "ReadyToMigrate": true,
      "StatusMessage": null,
      "DataProviders": [
        {
          "Id": "DP0",
          "Name": "Test5_QueryUsingQuery_WithSpace_TCV",
          "StatusMessage": null,
          "OracleDataSourceType": "Unx",
          "SnowflakeDataSourceType": "Unx",
          "OracleDataSourceId": 35230,
          "OracleDataSourceCuid": "AcljoUtBUs1Mmz1h8QIEmMQ",
          "OracleDataSourceName": "Total Customer View Daily Universe.unx",
          "SnowflakeDataSourceId": 8769479,
          "SnowflakeDataSourceCuid": "ATAa6szNqeZHnyRhX0mJqPc",
          "SnowflakeDataSourceName": "Total Customer View Daily Universe.unx"
        },
        {
          "Id": "DP5",
          "Name": "Test5_QueryUsingQuery_WithSpace_DP_DDW",
          "StatusMessage": null,
          "OracleDataSourceType": "Unx",
          "SnowflakeDataSourceType": "Unx",
          "OracleDataSourceId": 34887,
          "OracleDataSourceCuid": "AUidNnXFmy9Ouu2PNrFI27s",
          "OracleDataSourceName": "Deposit Daily - Production.unx",
          "SnowflakeDataSourceId": 8769439,
          "SnowflakeDataSourceCuid": "AReh9Rl.j41ClDWl9IXLO68",